{
  "analysis_id": "analysis_fixture_1",
  "contract_version": "1.0.0",
  "created_at": "2026-09-27T12:00:00Z",
  "input_asset_id": "asset_fixture_1",
  "input_sha256": "46abc778393d1570137b4c395912856da5c02233643e51b6d13facf18151c99a",
  "owner_id": "owner_fixture_1",
  "processed_sha256": "aecd336d36edf312cfdd887f8d0d133f0ee200a25346a82044d47e46e3cdb450",
  "run_id": "run_fixture_1",
  "versions": {
    "analysis_config": "494ff873c4bf7a309da8a78664999b2714980d90728c9c2c49b9012ae5494e68",
    "benchmark_release": null,
    "content_schema": "1.0.0",
    "engine": "0.1.0",
    "feature_schema": "1.0.0-draft",
    "feature_set": null,
    "method_manifest": "a4606d9925680ff135c6dd2c332bec51e3a2cf878383275a83fa8ecb0d20c835",
    "normalization": null,
    "quality_policy": "quality-policy/1",
    "template": "individual-report/1"
  }
}
