{
  "contract_version": "1.0.0",
  "analysis_id": "analysis_001",
  "run_id": "run_001",
  "owner_id": "owner_001",
  "input_asset_id": "asset_001",
  "input_sha256": "0000000000000000000000000000000000000000000000000000000000000000",
  "processed_sha256": "1111111111111111111111111111111111111111111111111111111111111111",
  "created_at": "2026-09-26T20:00:00Z",
  "versions": {
    "feature_schema": "1.0.0-draft",
    "engine": "0.1.0",
    "method_manifest": "a4606d9925680ff135c6dd2c332bec51e3a2cf878383275a83fa8ecb0d20c835",
    "analysis_config": "2222222222222222222222222222222222222222222222222222222222222222",
    "quality_policy": "quality-policy/1",
    "normalization": null,
    "feature_set": null,
    "benchmark_release": null,
    "content_schema": "1.0.0",
    "template": null
  }
}
